{
  "specversion": "1.0",
  "id": "ffffffff-ffff-4fff-8fff-fffffffffff2",
  "type": "profile.erasure.confirmed.v1",
  "source": "excellore/profile",
  "time": "2026-01-01T12:00:00Z",
  "tenantid": "22222222-2222-4222-8222-222222222222",
  "correlationid": "33333333-3333-4333-8333-333333333333",
  "actor": {
    "sub": "44444444-4444-4444-8444-444444444444",
    "type": "machine"
  },
  "data": {
    "scope": "tenant",
    "tenantId": "22222222-2222-4222-8222-222222222222",
    "service": "profile"
  }
}
